{
  "reflex_id": "RM-0001",
  "version": "reflex_memory_v0_1",
  "status": "accepted",
  "source_chronology_event_ids": [
    "CHR-2026-07-03-001"
  ],
  "created_at": "2026-07-03T08:10:00Z",
  "reviewed_at": "2026-07-03T08:15:00Z",
  "accepted_at": "2026-07-03T08:20:00Z",
  "accepted_by": "local_governance_review",
  "source_state": {
    "classification": "cco_reconciled",
    "limitations": [
      "Entry is derived from a reviewed chronology event.",
      "Entry may condition review posture only.",
      "Entry has no authority effect."
    ]
  },
  "trigger_pattern": "source_state_conflict",
  "stress_type": "source_integrity_risk",
  "boundary_risk": "Stale or unverified source state may be treated as current truth if not surfaced in future review context.",
  "review_posture_effect": "require_source_reconciliation_context",
  "evidence_refs": [
    "fixtures/reflex_memory/chronology_event_source_state_conflict.json",
    "fixtures/reflex_memory/reflex_memory_candidate_source_state_conflict.json",
    "docs/governance/reflex-memory-specification.md"
  ],
  "expiration_or_review_after": "2026-10-01",
  "authority_effect": "none",
  "non_authority_statement": "This Reflex Memory entry informs review context only. It does not approve, deny, authorize, block, route, settle, sign, execute, or replace local authority."
}
